{
  "schemaVersion": 1,
  "sessionSetName": "109-model-registry-and-pricing-truth",
  "pathAwareCritique": "advisory",
  "critiquedAt": "2026-08-04T16:50:40.768235-04:00",
  "critiques": [
    {
      "provider": "openai",
      "model": "gpt-5.6-sol",
      "verdict": "ISSUES_FOUND",
      "summary": "I read the pricing validator and its config-load wiring, the shipped registry, proposal and cost-report implementations, model-inventory/drift-guard wiring, discovery preference path, relevant tests, and Set 109's spec/change-log/reconciliation claims. The registry and drift wiring are present, but the new fail-closed no-rate contract has a material hole: a routable YAML entry with `pricing: null` loads successfully and is then treated as zero-priced.",
      "findings": [
        {
          "description": "Violation: the change-log claims, \"A routable entry with no rates. Config load raises,\" and pricing.py says every malformed declaration fails closed. Impact: a consumer can write `pricing: null` on an enabled/default-enabled model; config load accepts it, `resolve_rates` and the worst-case sort helpers treat it as $0.00, and that unknown-price model can win cheapest-candidate selection - exactly the breaking defect this guard claims to prevent. This should block merge because the new safety contract is bypassable by a natural YAML null value. Evidence: `validate_model_rates` sets `rows = entry.get(PRICING_KEY)`; the no-rate guard at ai_router/pricing.py:127 only fires when the key is absent, while the branch at ai_router/pricing.py:161 accepts `rows is None` and returns when no flat fields exist. The parameterized malformed-pricing test at ai_router/tests/test_pricing_schema.py:256 covers `[]`, string, `{}`, and `0`, but omits `None`. Fix: distinguish key presence from its value throughout validation: if `pricing` is present, require a non-empty list before the `rows is None` flat/absent branch (or make that branch conditional on `PRICING_KEY not in entry`), and add `None` to the malformed-pricing tests plus a config-load regression for an enabled entry with `pricing: null`.",
          "severity": "Major",
          "category": "correctness"
        }
      ]
    },
    {
      "provider": "google",
      "model": "gemini-2.5-pro",
      "verdict": "VERIFIED",
      "summary": "I have reviewed the changes for the 'Model Registry and Pricing Truth' session set and found them to be consistent with the claims made in the summary. My review focused on the most critical changes: the new pricing schema, the fail-closed guard for un-priced models, and the integration of the model inventory check into CI.\n\nI read `ai_router/router-config.yaml` and confirmed that all model registry changes described in the summary have been applied. The `gpt-5-6` alias is gone, replaced by explicit `sol`, `luna`, and `terra` entries. `sonnet` and `opus` are repointed, and the new pricing structures for tiered and time-sensitive rates are correctly implemented. All priced models have a `confirmed_on` date.\n\nI examined `ai_router/pricing.py`, which contains the new `validate_model_rates` function. The logic correctly implements the claimed fail-closed behavior: it raises a `PricingError` if a model is enabled for routing but has no pricing information. This prevents an un-priced model from being selected as the cheapest option, which was a significant risk. The implementation correctly distinguishes between routable models and identity-only models.\n\nI reviewed `ai_router/scripts/drift_guard.py` and confirmed that it now calls `check_model_registry_matches_providers`. I also inspected `ai_router/model_inventory.py` and its `check_registry` function. The logic correctly compares the `model_id`s in the configuration against the `model-inventory.lock` file and will cause the script to exit with a non-zero status if there is a mismatch, which will fail CI as intended.\n\nFinally, I checked the implementation of the discovery model preference in `ai_router/verify_session.py` and `ai_router/router-config.yaml`. The feature is implemented as claimed, and the pin for `gpt-5-6-luna` is committed but commented out, with extensive notes explaining why it is not active. This matches the summary's claim of shipping the capability but leaving it disabled.\n\nAll claims I checked were substantiated by the code. The changes appear to be correct, complete, and well-documented.",
      "findings": []
    }
  ]
}
