{
  "schemaVersion": 1,
  "sessionSetName": "104-copilot-cli-large-prompt-handoff",
  "pathAwareCritique": "advisory",
  "critiquedAt": "2026-07-15T03:10:49.463563-04:00",
  "critiques": [
    {
      "provider": "google",
      "model": "gemini-2.5-pro",
      "verdict": "VERIFIED",
      "summary": "I have reviewed the changes for session set `104-copilot-cli-large-prompt-handoff`. My review focused on verifying the implementation of the large-prompt file handoff for the Copilot CLI transport, the accuracy of the documentation and changelogs, and the resolution of the version-drift issue identified during the set's own verification.\n\nI read the following files:\n- `pyproject.toml`\n- `ai_router/__init__.py`\n- `ai_router/CHANGELOG.md`\n- `docs/session-sets/104-copilot-cli-large-prompt-handoff/change-log.md`\n- `ai_router/cli_transport.py`\n\nThe version in `pyproject.toml` and `ai_router/__init__.py` has been correctly bumped to `0.34.0`.\n\nThe implementation in `ai_router/cli_transport.py` correctly matches the specification. It uses a 24,000 UTF-16 unit threshold to switch from an inline command-line argument to a temporary file handoff. The implementation correctly handles Windows-specific constraints regarding command-line length and file handles. The nonce-based EOF acknowledgement mechanism is correctly implemented to be fail-closed, and the associated transport metadata fields are populated as described.\n\nThe `ai_router/CHANGELOG.md` accurately describes the changes and transparently discloses the known issue regarding the `copilot-catalog.lock` version drift (pinning 1.0.68 while the live probe used 1.0.69). The decision to defer the pin reconciliation to a future set is clearly documented as an operator-adjudicated decision, which is a sound resolution for a pre-existing condition that does not affect the default `api` transport profile.\n\nThe changes are correct, complete, and internally consistent. The discovered issue was handled with transparency and a reasonable, documented plan. Therefore, the set is verified.",
      "findings": []
    },
    {
      "provider": "anthropic",
      "model": "claude-sonnet-4-6",
      "verdict": "VERIFIED",
      "summary": "I read all of the key files for Set 104: the spec, both session change-logs, s2-live-probe.md, s2-remediation-round-1.md, s2-verification-round-2.md, ai_router/cli_transport.py (the full implementation), ai_router/tests/test_cli_transport.py (all 58 test cases including 25 new handoff-specific ones), pyproject.toml, ai_router/__init__.py, and ai_router/CHANGELOG.md.\n\nThe core implementation claims check out against the code on disk:\n1. The UTF-16 threshold measurement (_rendered_utf16_units) is correctly implemented using subprocess.list2cmdline + utf-16-le encoding + NUL unit, matching the spec's formula verbatim.\n2. The handoff branch fires at >= 24,000 units (< threshold → inline; >= threshold → handoff), exactly matching the spec. Tests confirm the boundary with monkeypatching.\n3. The payload file is UTF-8 no-BOM (written via os.fdopen(fd, \"wb\") with .encode(\"utf-8\")), closed before spawn (handle closed via context manager before _run is called), and contains the nonce only in the footer — not in argv.\n4. The nonce is a 128-bit secrets.token_hex(16) hex value. _validate_ack correctly identifies the final non-blank line and validates exact match. Missing and mismatch paths return (None, \"missing\") / (None, \"mismatch\") → ERROR_CLASS_HANDOFF_INCOMPLETE, which is absent from RETRYABLE_ERROR_CLASSES.\n5. Cleanup via finally in _run_handoff covers every exit path (success, spawn failure, both timeout classes, malformed JSONL), with retention only under DABBLER_COPILOT_DIAGNOSTICS. Tests verify cleanup on every path.\n6. payload_file_modified uses sha256 before spawn vs. after — correctly reads after the process exits and before the finally cleanup.\n7. The version-pin drift (1.0.69 probe vs. 1.0.68 lock) was correctly identified, disclosed, and adjudicated. The CHANGELOG Known Issue entry and s2-live-probe.md banner accurately reflect the fail-closed behavior of validate_catalog.\n8. Version numbers are consistent: pyproject.toml version = \"0.34.0\", ai_router/__init__.py __version__ = \"0.34.0\".\n\nThe one nit surfaced by the round-2 verifier — a broken cross-reference in s2-live-probe.md to \"s2-remediation-round-2.md\" (the file is actually named s2-remediation-round-1.md) — is present in the repository but is documentation-only and immaterial to any functional claim.",
      "findings": []
    }
  ]
}
